{
  "meta": {
    "kernel_release": "6.17.0-1022-azure",
    "arch": "x86_64",
    "distro": "Ubuntu 24.04.5 LTS",
    "collected_at": "2026-10-16T07:57:36+00:00",
    "trace_seconds": 5,
    "trace_backend": "none",
    "ran_as_root": false,
    "skipped": [
      {
        "reason": "not present",
        "source": "devnode:/dev/bpf"
      },
      {
        "reason": "not present",
        "source": "devnode:/dev/dri/card0"
      },
      {
        "reason": "not present",
        "source": "devnode:/dev/kmem"
      },
      {
        "reason": "not present",
        "source": "kconfig:/proc/config.gz"
      },
      {
        "reason": "exe unreadable: [Errno 13] Permission denied: '/proc/1/exe'",
        "source": "process:1"
      },
      {
        "reason": "exe unreadable: [Errno 13] Permission denied: '/proc/10/exe'",
        "source": "process:10"
      },
      {
        "reason": "exe unreadable: [Errno 13] Permission denied: '/proc/1004/exe'",
        "source": "process:1004"
      },
      {
        "reason": "exe unreadable: [Errno 13] Permission denied: '/proc/1009/exe'",
        "source": "process:1009"
      },
      {
        "reason": "exe unreadable: [Errno 13] Permission denied: '/proc/1011/exe'",
        "source": "process:1011"
      },
      {
        "reason": "exe unreadable: [Errno 13] Permission denied: '/proc/1016/exe'",
        "source": "process:1016"
      },
      {
        "reason": "exe unreadable: [Errno 13] Permission denied: '/proc/1028/exe'",
        "source": "process:1028"
      },
      {
        "reason": "exe unreadable: [Errno 13] Permission denied: '/proc/103/exe'",
        "source": "process:103"
      },
      {
        "reason": "exe unreadable: [Errno 13] Permission denied: '/proc/104/exe'",
        "source": "process:104"
      },
      {
        "reason": "exe unreadable: [Errno 13] Permission denied: '/proc/1045/exe'",
        "source": "process:1045"
      },
      {
        "reason": "exe unreadable: [Errno 13] Permission denied: '/proc/1046/exe'",
        "source": "process:1046"
      },
      {
        "reason": "exe unreadable: [Errno 13] Permission denied: '/proc/105/exe'",
        "source": "process:105"
      },
      {
        "reason": "exe unreadable: [Errno 13] Permission denied: '/proc/106/exe'",
        "source": "process:106"
      },
      {
        "reason": "exe unreadable: [Errno 13] Permission denied: '/proc/107/exe'",
        "source": "process:107"
      },
      {
        "reason": "exe unreadable: [Errno 13] Permission denied: '/proc/1074/exe'",
        "source": "process:1074"
      },
      {
        "reason": "exe unreadable: [Errno 13] Permission denied: '/proc/1083/exe'",
        "source": "process:1083"
      },
      {
        "reason": "exe unreadable: [Errno 13] Permission denied: '/proc/11/exe'",
        "source": "process:11"
      },
      {
        "reason": "exe unreadable: [Errno 13] Permission denied: '/proc/1107/exe'",
        "source": "process:1107"
      },
      {
        "reason": "exe unreadable: [Errno 13] Permission denied: '/proc/1115/exe'",
        "source": "process:1115"
      },
      {
        "reason": "exe unreadable: [Errno 13] Permission denied: '/proc/1129/exe'",
        "source": "process:1129"
      },
      {
        "reason": "exe unreadable: [Errno 13] Permission denied: '/proc/1172/exe'",
        "source": "process:1172"
      },
      {
        "reason": "exe unreadable: [Errno 13] Permission denied: '/proc/1176/exe'",
        "source": "process:1176"
      },
      {
        "reason": "exe unreadable: [Errno 13] Permission denied: '/proc/1180/exe'",
        "source": "process:1180"
      },
      {
        "reason": "exe unreadable: [Errno 13] Permission denied: '/proc/1186/exe'",
        "source": "process:1186"
      },
      {
        "reason": "exe unreadable: [Errno 13] Permission denied: '/proc/1194/exe'",
        "source": "process:1194"
      },
      {
        "reason": "exe unreadable: [Errno 13] Permission denied: '/proc/12/exe'",
        "source": "process:12"
      },
      {
        "reason": "exe unreadable: [Errno 13] Permission denied: '/proc/1205/exe'",
        "source": "process:1205"
      },
      {
        "reason": "exe unreadable: [Errno 13] Permission denied: '/proc/1209/exe'",
        "source": "process:1209"
      },
      {
        "reason": "exe unreadable: [Errno 13] Permission denied: '/proc/13/exe'",
        "source": "process:13"
      },
      {
        "reason": "exe unreadable: [Errno 13] Permission denied: '/proc/1323/exe'",
        "source": "process:1323"
      },
      {
        "reason": "exe unreadable: [Errno 13] Permission denied: '/proc/1329/exe'",
        "source": "process:1329"
      },
      {
        "reason": "exe unreadable: [Errno 13] Permission denied: '/proc/14/exe'",
        "source": "process:14"
      },
      {
        "reason": "exe unreadable: [Errno 13] Permission denied: '/proc/1404/exe'",
        "source": "process:1404"
      },
      {
        "reason": "exe unreadable: [Errno 13] Permission denied: '/proc/1478/exe'",
        "source": "process:1478"
      },
      {
        "reason": "exe unreadable: [Errno 13] Permission denied: '/proc/15/exe'",
        "source": "process:15"
      },
      {
        "reason": "exe unreadable: [Errno 13] Permission denied: '/proc/157/exe'",
        "source": "process:157"
      },
      {
        "reason": "exe unreadable: [Errno 13] Permission denied: '/proc/16/exe'",
        "source": "process:16"
      },
      {
        "reason": "exe unreadable: [Errno 13] Permission denied: '/proc/17/exe'",
        "source": "process:17"
      },
      {
        "reason": "exe unreadable: [Errno 13] Permission denied: '/proc/172/exe'",
        "source": "process:172"
      },
      {
        "reason": "exe unreadable: [Errno 13] Permission denied: '/proc/175/exe'",
        "source": "process:175"
      },
      {
        "reason": "exe unreadable: [Errno 13] Permission denied: '/proc/18/exe'",
        "source": "process:18"
      },
      {
        "reason": "exe unreadable: [Errno 13] Permission denied: '/proc/180/exe'",
        "source": "process:180"
      },
      {
        "reason": "exe unreadable: [Errno 13] Permission denied: '/proc/181/exe'",
        "source": "process:181"
      },
      {
        "reason": "exe unreadable: [Errno 13] Permission denied: '/proc/19/exe'",
        "source": "process:19"
      },
      {
        "reason": "exe unreadable: [Errno 13] Permission denied: '/proc/199/exe'",
        "source": "process:199"
      },
      {
        "reason": "exe unreadable: [Errno 13] Permission denied: '/proc/2/exe'",
        "source": "process:2"
      },
      {
        "reason": "exe unreadable: [Errno 13] Permission denied: '/proc/20/exe'",
        "source": "process:20"
      },
      {
        "reason": "exe unreadable: [Errno 13] Permission denied: '/proc/2069/exe'",
        "source": "process:2069"
      },
      {
        "reason": "exe unreadable: [Errno 13] Permission denied: '/proc/2088/exe'",
        "source": "process:2088"
      },
      {
        "reason": "exe unreadable: [Errno 13] Permission denied: '/proc/2090/exe'",
        "source": "process:2090"
      },
      {
        "reason": "exe unreadable: [Errno 13] Permission denied: '/proc/21/exe'",
        "source": "process:21"
      },
      {
        "reason": "exe unreadable: [Errno 13] Permission denied: '/proc/2125/exe'",
        "source": "process:2125"
      },
      {
        "reason": "exe unreadable: [Errno 13] Permission denied: '/proc/2128/exe'",
        "source": "process:2128"
      },
      {
        "reason": "exe unreadable: [Errno 13] Permission denied: '/proc/2129/exe'",
        "source": "process:2129"
      },
      {
        "reason": "exe unreadable: [Errno 13] Permission denied: '/proc/2130/exe'",
        "source": "process:2130"
      },
      {
        "reason": "exe unreadable: [Errno 13] Permission denied: '/proc/2131/exe'",
        "source": "process:2131"
      },
      {
        "reason": "exe unreadable: [Errno 13] Permission denied: '/proc/2132/exe'",
        "source": "process:2132"
      },
      {
        "reason": "exe unreadable: [Errno 13] Permission denied: '/proc/2133/exe'",
        "source": "process:2133"
      },
      {
        "reason": "exe unreadable: [Errno 13] Permission denied: '/proc/2134/exe'",
        "source": "process:2134"
      },
      {
        "reason": "exe unreadable: [Errno 13] Permission denied: '/proc/2135/exe'",
        "source": "process:2135"
      },
      {
        "reason": "exe unreadable: [Errno 13] Permission denied: '/proc/2147/exe'",
        "source": "process:2147"
      },
      {
        "reason": "exe unreadable: [Errno 13] Permission denied: '/proc/2148/exe'",
        "source": "process:2148"
      },
      {
        "reason": "exe unreadable: [Errno 13] Permission denied: '/proc/2149/exe'",
        "source": "process:2149"
      },
      {
        "reason": "exe unreadable: [Errno 13] Permission denied: '/proc/2150/exe'",
        "source": "process:2150"
      },
      {
        "reason": "exe unreadable: [Errno 13] Permission denied: '/proc/2151/exe'",
        "source": "process:2151"
      },
      {
        "reason": "exe unreadable: [Errno 13] Permission denied: '/proc/217/exe'",
        "source": "process:217"
      },
      {
        "reason": "exe unreadable: [Errno 13] Permission denied: '/proc/22/exe'",
        "source": "process:22"
      },
      {
        "reason": "exe unreadable: [Errno 13] Permission denied: '/proc/221/exe'",
        "source": "process:221"
      },
      {
        "reason": "exe unreadable: [Errno 13] Permission denied: '/proc/227/exe'",
        "source": "process:227"
      },
      {
        "reason": "exe unreadable: [Errno 13] Permission denied: '/proc/23/exe'",
        "source": "process:23"
      },
      {
        "reason": "exe unreadable: [Errno 13] Permission denied: '/proc/238/exe'",